スポット名,ファイル名,説明,リンク
掛川花鳥園,spot01,花の中で鳥と遊べる全天候型テーマパーク。掛川花鳥園の鳥たちはほとんどがケージや檻の中に入っていないため、直接ふれあうことができます。感動ものです。,http://k-hana-tori.com/about#link_about
掛川城,spot02,掛川城は日本100名城に選ばれました本格木造で復元された天守閣があるお城です。アニメの舞台にもなったお城です。掛川城天守閣からの眺めは最高　　掛川市はアニメの聖地で掛川城の近くのおでんやさんやＪＲ掛川駅もアニメに登場しました。,https://ja.wikipedia.org/wiki/%E6%8E%9B%E5%B7%9D%E5%9F%8E#.E5.BE.A9.E5.85.83
掛川二の丸美術館,spot03,"掛川城公園に位置する二の丸技術館は、日本瓦葺きの木造風の建物です　　細密工芸品を主とする木下コレクションと、近代日本画を収集した鈴木コレクションを主に収蔵しています。 　木下コレクションは、江戸から明治にかけてのたばこ道具、印籠、刀装具、書画など約2,300点を数え、なかでもたばこ道具は秀逸な作品が数多く収集されています。",http://kidsart-shizuoka.com/museum/ninomaru
ご当地グルメ　たまごふわふわ料理（日本最古のたまご料理）,spot04,1626年京都二条城にて開かれた将軍家の饗応料理の献立の一品でもあり、当時は武士や豪商が食したセレブ料理でした。 200年以上の時を経て袋井の新名物「ご当地B級グルメ」として全国的に知られるようになってきて、今では遠方からわざわざ食べに来られる方も少なくありません。 材料は「卵」と「だし汁」だけのシンプルな料理ですが、「ふわっ」とした食感と風味豊かな味がお楽しみいただけます。はるか昔、江戸時代の名物料理をご賞味ください。,http://shizuoka.mytabi.net/hamamatsu/archives/tamagofuwafuwa.php
ご当地グルメ・・静岡おでん,spot05,静岡市を中心に富士川から大井川までの県中部で主に食べられてきた。肉や練り物から出ただしとしょうゆなどが味のベース。地元観光協会や関係団体によると、黒はんぺんが入っている▽串に刺さっている▽だし粉と青のりをふりかけて食べる▽スープが黒い――といった特徴がある。静岡県中部地方では大正時代から庶民の味としておでんが親しまれてきました。飲み屋や駄菓子屋におでん鍋があり、子供も大人も一年中おでんを食べます。夏はおでんの後にカキ氷を食べたりします。静岡市にはプールの前におでん屋が何軒もあるそうです。焼津市にはおでん売ってるプール（通称：おでんプール）があったそうです。静岡市内に６００軒、静岡駅中心街だけで７０軒のおでん屋があり、「おでん横丁」という横丁もあります。,http://daturyoku.webcrow.jp/sizu/sonota2/oden/oden.html
静岡のご当地グルメ・・浜松餃子,spot06,「東の宇都宮、西の浜松」とも言われ、2012年に一世帯あたりの餃子の消費額が日本一となった浜松市。その発祥は、昭和30年代はじめに中国からのひきあげ者が浜松駅周辺で開いた小さな屋台がきっかけ。現在は、400軒以上の餃子提供店がありながら、昔ながらのお持ち帰り文化も健在！,http://www.tnc.ne.jp/special/gotouchi/gyoza/index.html
